{
  "search_space_version": "0.1",
  "base_candidate": {
    "qadl_version": "0.1",
    "candidate_id": "grover-resource-tradeoff",
    "title": "Toy resource tradeoff for a black-box search implementation",
    "tags": [
      "example-only"
    ],
    "problem": {
      "family": "search",
      "task": "Find a marked item among N items under a unique-solution promise.",
      "instance_distribution": "All black-box predicates with exactly one marked input.",
      "size_parameters": [
        {
          "name": "N",
          "domain": "positive-integer",
          "lower_bound": 4
        }
      ],
      "promises": [
        "N is a power of two.",
        "N is at least four.",
        "Exactly one input is marked."
      ],
      "input": {
        "representation": "Coherent phase oracle.",
        "access_model": "black-box-oracle",
        "preparation_cost": "1",
        "oracle_construction_cost": "unknown",
        "assumptions": [
          "The phase oracle is provided."
        ]
      },
      "output": {
        "representation": "classical-vector",
        "contract": "Return the unique marked index.",
        "accuracy": "0",
        "success_probability": "2 / 3",
        "readout_cost": "1"
      },
      "classical_baselines": [
        {
          "id": "black-box-scan",
          "name": "Randomized black-box search",
          "algorithm_class": "randomized query algorithm",
          "access_model": "black-box-oracle",
          "output_contract": "Return the unique marked index.",
          "resources": {
            "queries": "N"
          },
          "source": {
            "url": "https://doi.org/10.1145/237814.237866",
            "status": "source_supported"
          }
        }
      ]
    },
    "algorithm": {
      "model": "query",
      "stages": [
        {
          "id": "search",
          "domain": "quantum",
          "operation": "Run amplitude amplification.",
          "primitive": "amplitude-amplification",
          "depends_on": [],
          "repetitions": "floor(pi / (4 * asin(1 / sqrt(N))))",
          "resources": {
            "queries": "floor(pi / (4 * asin(1 / sqrt(N))))"
          },
          "contract": {
            "precondition": "One item is marked",
            "postcondition": "Marked overlap is at least 2/3"
          }
        }
      ],
      "correctness_contract": {
        "precondition": "The black-box promise holds.",
        "postcondition": "Return the marked index.",
        "failure_probability": "1 / 3"
      }
    },
    "resources": {
      "model": "query",
      "expressions": {
        "queries": "floor(pi / (4 * asin(1 / sqrt(N))))",
        "logical_qubits": "ceil(log2(N)) + 1",
        "t_depth": "4 * ceil(sqrt(N))"
      },
      "error_budget": {
        "algorithmic_failure": "1 / 3"
      },
      "assumptions": [
        "The two resource variants are illustrative declarations, not compiled circuits."
      ]
    },
    "proof_obligations": [
      {
        "id": "correctness",
        "kind": "correctness",
        "statement": "The selected implementation preserves amplitude-amplification semantics.",
        "status": "proof-sketch",
        "method": "Analytic argument",
        "artifacts": [
          "https://doi.org/10.1090/conm/305/05215"
        ]
      },
      {
        "id": "resource",
        "kind": "resource",
        "statement": "Compile each implementation variant before accepting its declared cost.",
        "status": "open",
        "method": "Resource estimator",
        "artifacts": []
      },
      {
        "id": "advantage",
        "kind": "advantage",
        "statement": "Only the black-box query comparison is in scope.",
        "status": "proof-sketch",
        "method": "Matched query model",
        "artifacts": [
          "https://doi.org/10.1145/237814.237866"
        ]
      }
    ],
    "claim": {
      "type": "query-advantage",
      "status": "proof-sketch",
      "scope": "query",
      "baseline_id": "black-box-scan",
      "statement": "Conditional quadratic query advantage.",
      "evidence": [
        {
          "url": "https://doi.org/10.1090/conm/305/05215",
          "status": "source_supported"
        }
      ],
      "caveats": [
        "Do not interpret the search score as a correctness or speedup proof."
      ]
    },
    "provenance": {
      "generated_by": "quantum-algorithm-designer search example",
      "created_at": "2026-07-18T16:00:00+08:00",
      "random_seed": null,
      "parent_ids": [],
      "sources": []
    }
  },
  "choices": [
    {
      "path": "/resources/expressions",
      "description": "Illustrative depth/width tradeoff between two unverified implementations.",
      "values": [
        {
          "queries": "floor(pi / (4 * asin(1 / sqrt(N))))",
          "logical_qubits": "ceil(log2(N)) + 1",
          "t_depth": "4 * ceil(sqrt(N))"
        },
        {
          "queries": "floor(pi / (4 * asin(1 / sqrt(N))))",
          "logical_qubits": "2 * ceil(log2(N)) + 2",
          "t_depth": "2 * ceil(sqrt(N))"
        }
      ]
    }
  ],
  "evaluation": {
    "parameter_points": [
      {
        "N": 16
      },
      {
        "N": 256
      },
      {
        "N": 4096
      }
    ],
    "objectives": [
      {
        "name": "logical qubits",
        "metric": "resource:logical_qubits:max",
        "direction": "minimize",
        "weight": 1
      },
      {
        "name": "T depth",
        "metric": "resource:t_depth:mean",
        "direction": "minimize",
        "weight": 0.01
      }
    ],
    "hard_constraints": [
      {
        "metric": "validation_errors",
        "op": "==",
        "value": 0
      },
      {
        "metric": "claim_blockers",
        "op": "==",
        "value": 0
      }
    ]
  }
}
